client_id	path	sentence	up_votes	down_votes	age	gender	accent
391f19cc56c80b71950a424f9dff058a997032adeb86035391cb71d437f6de3168091c5a7aad0cbd28cc5ae0c66ba67c4e000ce26070c6d3e2810288267220b9	common_voice_ru_18881853.mp3	Благодарю представителя Швейцарии за ее заявление.	2	0	twenties	male	
391f19cc56c80b71950a424f9dff058a997032adeb86035391cb71d437f6de3168091c5a7aad0cbd28cc5ae0c66ba67c4e000ce26070c6d3e2810288267220b9	common_voice_ru_18881856.mp3	Меня это очень трогает.	2	0	twenties	male	
391f19cc56c80b71950a424f9dff058a997032adeb86035391cb71d437f6de3168091c5a7aad0cbd28cc5ae0c66ba67c4e000ce26070c6d3e2810288267220b9	common_voice_ru_18881858.mp3	Еще раз позвольте мне подчеркнуть, что этот вопрос, очевидно, обсуждался предварительно нашими политическими координаторами.	2	0	twenties	male	
391f19cc56c80b71950a424f9dff058a997032adeb86035391cb71d437f6de3168091c5a7aad0cbd28cc5ae0c66ba67c4e000ce26070c6d3e2810288267220b9	common_voice_ru_18881859.mp3	Я уже не помню, кто кого ловил и что там было.	2	0	twenties	male	
391f19cc56c80b71950a424f9dff058a997032adeb86035391cb71d437f6de3168091c5a7aad0cbd28cc5ae0c66ba67c4e000ce26070c6d3e2810288267220b9	common_voice_ru_18881860.mp3	А теперь слово имеет следующий оратор у меня в списке − посол Австралии.	2	0	twenties	male	
391f19cc56c80b71950a424f9dff058a997032adeb86035391cb71d437f6de3168091c5a7aad0cbd28cc5ae0c66ba67c4e000ce26070c6d3e2810288267220b9	common_voice_ru_18881861.mp3	Мы стали строить специальные программы, которые давали возможность серьезно отнестись к этому делу.	2	0	twenties	male	
391f19cc56c80b71950a424f9dff058a997032adeb86035391cb71d437f6de3168091c5a7aad0cbd28cc5ae0c66ba67c4e000ce26070c6d3e2810288267220b9	common_voice_ru_18881865.mp3	Было бы парадоксально и то, что мы обсуждаем этот вопрос сегодня.	2	0	twenties	male	
391f19cc56c80b71950a424f9dff058a997032adeb86035391cb71d437f6de3168091c5a7aad0cbd28cc5ae0c66ba67c4e000ce26070c6d3e2810288267220b9	common_voice_ru_18881867.mp3	В принципе, всё верно, но в каждом отдельном случае есть свои особенности.	2	0	twenties	male	
391f19cc56c80b71950a424f9dff058a997032adeb86035391cb71d437f6de3168091c5a7aad0cbd28cc5ae0c66ba67c4e000ce26070c6d3e2810288267220b9	common_voice_ru_18881868.mp3	Сегодня такой день – отказать было нельзя.	2	0	twenties	male	
391f19cc56c80b71950a424f9dff058a997032adeb86035391cb71d437f6de3168091c5a7aad0cbd28cc5ae0c66ba67c4e000ce26070c6d3e2810288267220b9	common_voice_ru_18881869.mp3	Что они снова от меня хотят?	2	0	twenties	male	
391f19cc56c80b71950a424f9dff058a997032adeb86035391cb71d437f6de3168091c5a7aad0cbd28cc5ae0c66ba67c4e000ce26070c6d3e2810288267220b9	common_voice_ru_18881870.mp3	Эй ты, немецкий шляпник!	2	0	twenties	male	
391f19cc56c80b71950a424f9dff058a997032adeb86035391cb71d437f6de3168091c5a7aad0cbd28cc5ae0c66ba67c4e000ce26070c6d3e2810288267220b9	common_voice_ru_18881871.mp3	Судебная власть осуществляется посредством конституционного, гражданского, административного и уголовного судопроизводства.	2	1	twenties	male	
391f19cc56c80b71950a424f9dff058a997032adeb86035391cb71d437f6de3168091c5a7aad0cbd28cc5ae0c66ba67c4e000ce26070c6d3e2810288267220b9	common_voice_ru_18881872.mp3	Это что же такое? – переворачивая пакет и оглядывая разинувших рты ребят, спросил Квакин.	2	0	twenties	male	
391f19cc56c80b71950a424f9dff058a997032adeb86035391cb71d437f6de3168091c5a7aad0cbd28cc5ae0c66ba67c4e000ce26070c6d3e2810288267220b9	common_voice_ru_18881876.mp3	Нуакшот является столицей Мавритании.	2	0	twenties	male	
391f19cc56c80b71950a424f9dff058a997032adeb86035391cb71d437f6de3168091c5a7aad0cbd28cc5ae0c66ba67c4e000ce26070c6d3e2810288267220b9	common_voice_ru_18881877.mp3	И, очутившись прижатой к углу, Женя вскрикнула.	2	0	twenties	male	
391f19cc56c80b71950a424f9dff058a997032adeb86035391cb71d437f6de3168091c5a7aad0cbd28cc5ae0c66ba67c4e000ce26070c6d3e2810288267220b9	common_voice_ru_18881878.mp3	Лена отвернулась.	2	0	twenties	male	
391f19cc56c80b71950a424f9dff058a997032adeb86035391cb71d437f6de3168091c5a7aad0cbd28cc5ae0c66ba67c4e000ce26070c6d3e2810288267220b9	common_voice_ru_18881879.mp3	Для того, чтобы заниматься этим спортом нужны клюшка, шайба, маска и ласты.	2	0	twenties	male	
391f19cc56c80b71950a424f9dff058a997032adeb86035391cb71d437f6de3168091c5a7aad0cbd28cc5ae0c66ba67c4e000ce26070c6d3e2810288267220b9	common_voice_ru_18881882.mp3	Должны пресекаться попытки расшатать государственный суверенитет и целостность Сомали.	2	0	twenties	male	
391f19cc56c80b71950a424f9dff058a997032adeb86035391cb71d437f6de3168091c5a7aad0cbd28cc5ae0c66ba67c4e000ce26070c6d3e2810288267220b9	common_voice_ru_18881886.mp3	Мы считаем, что, прилагая эти усилия, мы должны руководствоваться тремя четкими принципами.	2	0	twenties	male	
391f19cc56c80b71950a424f9dff058a997032adeb86035391cb71d437f6de3168091c5a7aad0cbd28cc5ae0c66ba67c4e000ce26070c6d3e2810288267220b9	common_voice_ru_18881890.mp3	Третья рекомендация предполагает обеспечение поддержки на международном уровне.	2	0	twenties	male	
391f19cc56c80b71950a424f9dff058a997032adeb86035391cb71d437f6de3168091c5a7aad0cbd28cc5ae0c66ba67c4e000ce26070c6d3e2810288267220b9	common_voice_ru_18881892.mp3	Сухопутная торговля между Востоком и Западом утратила свою актуальность.	2	0	twenties	male	
391f19cc56c80b71950a424f9dff058a997032adeb86035391cb71d437f6de3168091c5a7aad0cbd28cc5ae0c66ba67c4e000ce26070c6d3e2810288267220b9	common_voice_ru_18881895.mp3	Головной офис фирмы находился в Новосибирске.	2	0	twenties	male	
391f19cc56c80b71950a424f9dff058a997032adeb86035391cb71d437f6de3168091c5a7aad0cbd28cc5ae0c66ba67c4e000ce26070c6d3e2810288267220b9	common_voice_ru_18881902.mp3	Одно из самых перспективных — медицинский анализатор.	2	0	twenties	male	
391f19cc56c80b71950a424f9dff058a997032adeb86035391cb71d437f6de3168091c5a7aad0cbd28cc5ae0c66ba67c4e000ce26070c6d3e2810288267220b9	common_voice_ru_18881905.mp3	Он не заплачет.	2	0	twenties	male	
391f19cc56c80b71950a424f9dff058a997032adeb86035391cb71d437f6de3168091c5a7aad0cbd28cc5ae0c66ba67c4e000ce26070c6d3e2810288267220b9	common_voice_ru_18881906.mp3	И в этом барахле мы должны увидеть скульптуру?	2	0	twenties	male	
391f19cc56c80b71950a424f9dff058a997032adeb86035391cb71d437f6de3168091c5a7aad0cbd28cc5ae0c66ba67c4e000ce26070c6d3e2810288267220b9	common_voice_ru_18881909.mp3	Оно дает также гарантию, что заключенные соглашения будут применяться всеми теми, кто их принял.	2	0	twenties	male	
391f19cc56c80b71950a424f9dff058a997032adeb86035391cb71d437f6de3168091c5a7aad0cbd28cc5ae0c66ba67c4e000ce26070c6d3e2810288267220b9	common_voice_ru_18881910.mp3	Я хотел бы настоятельно призвать всех доноров помочь ликвидировать этот дефицит ресурсов.	2	0	twenties	male	
391f19cc56c80b71950a424f9dff058a997032adeb86035391cb71d437f6de3168091c5a7aad0cbd28cc5ae0c66ba67c4e000ce26070c6d3e2810288267220b9	common_voice_ru_18881911.mp3	Могу ли я считать, что Ассамблея намерена поступить таким же образом?	2	0	twenties	male	
391f19cc56c80b71950a424f9dff058a997032adeb86035391cb71d437f6de3168091c5a7aad0cbd28cc5ae0c66ba67c4e000ce26070c6d3e2810288267220b9	common_voice_ru_18881912.mp3	Исходя из этой позиции, моя делегация проголосовала за эту резолюцию.	2	0	twenties	male	
391f19cc56c80b71950a424f9dff058a997032adeb86035391cb71d437f6de3168091c5a7aad0cbd28cc5ae0c66ba67c4e000ce26070c6d3e2810288267220b9	common_voice_ru_18881913.mp3	Разжигай уже, пожалуй, гриль.	2	0	twenties	male	
391f19cc56c80b71950a424f9dff058a997032adeb86035391cb71d437f6de3168091c5a7aad0cbd28cc5ae0c66ba67c4e000ce26070c6d3e2810288267220b9	common_voice_ru_18881914.mp3	Гуманитарная ситуация в Сомали по-прежнему вызывает серьезную озабоченность.	2	0	twenties	male	
391f19cc56c80b71950a424f9dff058a997032adeb86035391cb71d437f6de3168091c5a7aad0cbd28cc5ae0c66ba67c4e000ce26070c6d3e2810288267220b9	common_voice_ru_18881915.mp3	Мой Тимур хотел ваш дом ограбить?	2	0	twenties	male	
391f19cc56c80b71950a424f9dff058a997032adeb86035391cb71d437f6de3168091c5a7aad0cbd28cc5ae0c66ba67c4e000ce26070c6d3e2810288267220b9	common_voice_ru_18881916.mp3	Миллионы людей во всем мире с надеждой смотрят на Организацию Объединенных Наций.	2	0	twenties	male	
391f19cc56c80b71950a424f9dff058a997032adeb86035391cb71d437f6de3168091c5a7aad0cbd28cc5ae0c66ba67c4e000ce26070c6d3e2810288267220b9	common_voice_ru_18881917.mp3	Ну а в чем же тут причина?	2	0	twenties	male	
391f19cc56c80b71950a424f9dff058a997032adeb86035391cb71d437f6de3168091c5a7aad0cbd28cc5ae0c66ba67c4e000ce26070c6d3e2810288267220b9	common_voice_ru_18881918.mp3	Он даже знал, сколько шагов от ворот его дома.	2	0	twenties	male	
391f19cc56c80b71950a424f9dff058a997032adeb86035391cb71d437f6de3168091c5a7aad0cbd28cc5ae0c66ba67c4e000ce26070c6d3e2810288267220b9	common_voice_ru_18881919.mp3	Мы слышим неоднократные ссылки на мандат Шеннон в качестве основы для урегулирования проблемы запасов.	2	0	twenties	male	
391f19cc56c80b71950a424f9dff058a997032adeb86035391cb71d437f6de3168091c5a7aad0cbd28cc5ae0c66ba67c4e000ce26070c6d3e2810288267220b9	common_voice_ru_18881921.mp3	Благодарю посла Соединенного Королевства Великобритании и Северной Ирландии за ее заявление.	2	0	twenties	male	
391f19cc56c80b71950a424f9dff058a997032adeb86035391cb71d437f6de3168091c5a7aad0cbd28cc5ae0c66ba67c4e000ce26070c6d3e2810288267220b9	common_voice_ru_18881922.mp3	А разговаривать с вами будем мы после.	2	0	twenties	male	
391f19cc56c80b71950a424f9dff058a997032adeb86035391cb71d437f6de3168091c5a7aad0cbd28cc5ae0c66ba67c4e000ce26070c6d3e2810288267220b9	common_voice_ru_18881924.mp3	Я сделал эту ошибку при последней попытке.	2	0	twenties	male	
391f19cc56c80b71950a424f9dff058a997032adeb86035391cb71d437f6de3168091c5a7aad0cbd28cc5ae0c66ba67c4e000ce26070c6d3e2810288267220b9	common_voice_ru_18881927.mp3	Я рад присутствовать здесь сегодня по случаю окончания Международного года молодежи.	2	0	twenties	male	
391f19cc56c80b71950a424f9dff058a997032adeb86035391cb71d437f6de3168091c5a7aad0cbd28cc5ae0c66ba67c4e000ce26070c6d3e2810288267220b9	common_voice_ru_18881929.mp3	Для меня было удовольствием работать с Вами и Вашей замечательной командой.	2	0	twenties	male	
391f19cc56c80b71950a424f9dff058a997032adeb86035391cb71d437f6de3168091c5a7aad0cbd28cc5ae0c66ba67c4e000ce26070c6d3e2810288267220b9	common_voice_ru_18881933.mp3	Им приходится хуже всего.	2	0	twenties	male	
391f19cc56c80b71950a424f9dff058a997032adeb86035391cb71d437f6de3168091c5a7aad0cbd28cc5ae0c66ba67c4e000ce26070c6d3e2810288267220b9	common_voice_ru_18881936.mp3	Воспользовавшись таким случаем, Женя прервала опасный разговор и кинулась в сад выгонять козу.	2	0	twenties	male	
391f19cc56c80b71950a424f9dff058a997032adeb86035391cb71d437f6de3168091c5a7aad0cbd28cc5ae0c66ba67c4e000ce26070c6d3e2810288267220b9	common_voice_ru_18881937.mp3	И чтобы устранить эту угрозу, требуются незамедлительные действия со стороны государств, обладающих ядерным оружием.	2	0	twenties	male	
391f19cc56c80b71950a424f9dff058a997032adeb86035391cb71d437f6de3168091c5a7aad0cbd28cc5ae0c66ba67c4e000ce26070c6d3e2810288267220b9	common_voice_ru_18881940.mp3	По словам режиссера, церковники пытаются воспрепятствовать планируемому выходу фильма в прокат Франции.	2	1	twenties	male	
391f19cc56c80b71950a424f9dff058a997032adeb86035391cb71d437f6de3168091c5a7aad0cbd28cc5ae0c66ba67c4e000ce26070c6d3e2810288267220b9	common_voice_ru_18881941.mp3	Это критически важный момент для Сомали.	2	0	twenties	male	
391f19cc56c80b71950a424f9dff058a997032adeb86035391cb71d437f6de3168091c5a7aad0cbd28cc5ae0c66ba67c4e000ce26070c6d3e2810288267220b9	common_voice_ru_18881943.mp3	Мы надеемся на дальнейшее тесное сотрудничество с ним.	2	0	twenties	male	
391f19cc56c80b71950a424f9dff058a997032adeb86035391cb71d437f6de3168091c5a7aad0cbd28cc5ae0c66ba67c4e000ce26070c6d3e2810288267220b9	common_voice_ru_18881945.mp3	Я благодарю господина Кундерса за брифинг.	2	0	twenties	male	
391f19cc56c80b71950a424f9dff058a997032adeb86035391cb71d437f6de3168091c5a7aad0cbd28cc5ae0c66ba67c4e000ce26070c6d3e2810288267220b9	common_voice_ru_18881948.mp3	У нас тут что-то на радаре.	2	0	twenties	male	
391f19cc56c80b71950a424f9dff058a997032adeb86035391cb71d437f6de3168091c5a7aad0cbd28cc5ae0c66ba67c4e000ce26070c6d3e2810288267220b9	common_voice_ru_18881949.mp3	Людей вблизи не было.	2	0	twenties	male	
391f19cc56c80b71950a424f9dff058a997032adeb86035391cb71d437f6de3168091c5a7aad0cbd28cc5ae0c66ba67c4e000ce26070c6d3e2810288267220b9	common_voice_ru_18881951.mp3	Во-первых, следует уделять внимание молодежи социально изолированных слоев населения.	2	0	twenties	male	
391f19cc56c80b71950a424f9dff058a997032adeb86035391cb71d437f6de3168091c5a7aad0cbd28cc5ae0c66ba67c4e000ce26070c6d3e2810288267220b9	common_voice_ru_18881954.mp3	Мы ценим его вклад и надеемся, что такое сотрудничество будет продолжаться и впредь.	2	0	twenties	male	
391f19cc56c80b71950a424f9dff058a997032adeb86035391cb71d437f6de3168091c5a7aad0cbd28cc5ae0c66ba67c4e000ce26070c6d3e2810288267220b9	common_voice_ru_18881955.mp3	Во-вторых, каждая страна — это особый случай, и поэтому каждой приходится решать свои проблемы.	2	0	twenties	male	
391f19cc56c80b71950a424f9dff058a997032adeb86035391cb71d437f6de3168091c5a7aad0cbd28cc5ae0c66ba67c4e000ce26070c6d3e2810288267220b9	common_voice_ru_18881960.mp3	Кругом был разор и беспорядок.	2	0	twenties	male	
391f19cc56c80b71950a424f9dff058a997032adeb86035391cb71d437f6de3168091c5a7aad0cbd28cc5ae0c66ba67c4e000ce26070c6d3e2810288267220b9	common_voice_ru_18881962.mp3	Одним из ключевых вопросов в любой постконфликтной стране является вопрос реформы сектора безопасности.	2	0	twenties	male	
391f19cc56c80b71950a424f9dff058a997032adeb86035391cb71d437f6de3168091c5a7aad0cbd28cc5ae0c66ba67c4e000ce26070c6d3e2810288267220b9	common_voice_ru_18881966.mp3	Эти операции также четко высветили пробелы в потенциале правоохранительных органов.	2	0	twenties	male	
391f19cc56c80b71950a424f9dff058a997032adeb86035391cb71d437f6de3168091c5a7aad0cbd28cc5ae0c66ba67c4e000ce26070c6d3e2810288267220b9	common_voice_ru_18881967.mp3	Просто невозможно передать то, насколько нынешняя ситуация изменилась к лучшему, по сравнению с прошлым.	2	0	twenties	male	
391f19cc56c80b71950a424f9dff058a997032adeb86035391cb71d437f6de3168091c5a7aad0cbd28cc5ae0c66ba67c4e000ce26070c6d3e2810288267220b9	common_voice_ru_18881968.mp3	Еще более тревожит то, что большинство преступников остаются на свободе.	2	0	twenties	male	
391f19cc56c80b71950a424f9dff058a997032adeb86035391cb71d437f6de3168091c5a7aad0cbd28cc5ae0c66ba67c4e000ce26070c6d3e2810288267220b9	common_voice_ru_18881969.mp3	Ольга подняла и прочла: «Девочка, никого дома не бойся.	2	0	twenties	male	
391f19cc56c80b71950a424f9dff058a997032adeb86035391cb71d437f6de3168091c5a7aad0cbd28cc5ae0c66ba67c4e000ce26070c6d3e2810288267220b9	common_voice_ru_18881973.mp3	Мы должны разрядить сложившуюся ситуацию.	2	1	twenties	male	
391f19cc56c80b71950a424f9dff058a997032adeb86035391cb71d437f6de3168091c5a7aad0cbd28cc5ae0c66ba67c4e000ce26070c6d3e2810288267220b9	common_voice_ru_18881975.mp3	В ряде стран ситуация весьма неспокойная.	2	0	twenties	male	
391f19cc56c80b71950a424f9dff058a997032adeb86035391cb71d437f6de3168091c5a7aad0cbd28cc5ae0c66ba67c4e000ce26070c6d3e2810288267220b9	common_voice_ru_18881977.mp3	Начиная с сентября уже произошел целый ряд важных событий.	2	0	twenties	male	
391f19cc56c80b71950a424f9dff058a997032adeb86035391cb71d437f6de3168091c5a7aad0cbd28cc5ae0c66ba67c4e000ce26070c6d3e2810288267220b9	common_voice_ru_18881979.mp3	Все тело должно быть напряжено.	2	0	twenties	male	
391f19cc56c80b71950a424f9dff058a997032adeb86035391cb71d437f6de3168091c5a7aad0cbd28cc5ae0c66ba67c4e000ce26070c6d3e2810288267220b9	common_voice_ru_18881982.mp3	Как-то раз он их сосчитал, когда уж очень размечтался.	2	0	twenties	male	
391f19cc56c80b71950a424f9dff058a997032adeb86035391cb71d437f6de3168091c5a7aad0cbd28cc5ae0c66ba67c4e000ce26070c6d3e2810288267220b9	common_voice_ru_18881983.mp3	Мы полностью поддерживаем его в выполнении его непростых обязанностей и функций.	2	0	twenties	male	
391f19cc56c80b71950a424f9dff058a997032adeb86035391cb71d437f6de3168091c5a7aad0cbd28cc5ae0c66ba67c4e000ce26070c6d3e2810288267220b9	common_voice_ru_18881985.mp3	Религиозные объединения отделены от государства и равны перед законом.	2	0	twenties	male	
391f19cc56c80b71950a424f9dff058a997032adeb86035391cb71d437f6de3168091c5a7aad0cbd28cc5ae0c66ba67c4e000ce26070c6d3e2810288267220b9	common_voice_ru_18881986.mp3	Мы благодарим делегацию Соединенного Королевства за организацию этой важной дискуссии.	2	0	twenties	male	
391f19cc56c80b71950a424f9dff058a997032adeb86035391cb71d437f6de3168091c5a7aad0cbd28cc5ae0c66ba67c4e000ce26070c6d3e2810288267220b9	common_voice_ru_18881988.mp3	Однако эти нарушения были недостаточно масштабными, чтобы подорвать сам процесс.	2	0	twenties	male	
391f19cc56c80b71950a424f9dff058a997032adeb86035391cb71d437f6de3168091c5a7aad0cbd28cc5ae0c66ba67c4e000ce26070c6d3e2810288267220b9	common_voice_ru_18881991.mp3	Как сознает Генеральный секретарь, задача эта далеко не простая.	2	0	twenties	male	
391f19cc56c80b71950a424f9dff058a997032adeb86035391cb71d437f6de3168091c5a7aad0cbd28cc5ae0c66ba67c4e000ce26070c6d3e2810288267220b9	common_voice_ru_18881994.mp3	Благодарю представителя Пакистана за его заявление и за его добрые слова.	2	0	twenties	male	
391f19cc56c80b71950a424f9dff058a997032adeb86035391cb71d437f6de3168091c5a7aad0cbd28cc5ae0c66ba67c4e000ce26070c6d3e2810288267220b9	common_voice_ru_18881998.mp3	Пятьдесят три миллиарда восемьсот восемьдесят два миллиона триста пятьдесят девять тысяч шестьсот восемнадцать.	2	0	twenties	male	
391f19cc56c80b71950a424f9dff058a997032adeb86035391cb71d437f6de3168091c5a7aad0cbd28cc5ae0c66ba67c4e000ce26070c6d3e2810288267220b9	common_voice_ru_18882000.mp3	Это планировалось предпринять, чтобы сократить время трансляции церемонии и повысить интерес телезрителей.	2	0	twenties	male	
391f19cc56c80b71950a424f9dff058a997032adeb86035391cb71d437f6de3168091c5a7aad0cbd28cc5ae0c66ba67c4e000ce26070c6d3e2810288267220b9	common_voice_ru_18882005.mp3	Я хочу пожаловаться на плохое обслуживание в мастерской.	2	0	twenties	male	
391f19cc56c80b71950a424f9dff058a997032adeb86035391cb71d437f6de3168091c5a7aad0cbd28cc5ae0c66ba67c4e000ce26070c6d3e2810288267220b9	common_voice_ru_18882007.mp3	Ольга пробралась через орешник и смахнула с лица паутину.	2	0	twenties	male	
391f19cc56c80b71950a424f9dff058a997032adeb86035391cb71d437f6de3168091c5a7aad0cbd28cc5ae0c66ba67c4e000ce26070c6d3e2810288267220b9	common_voice_ru_18882008.mp3	И куда девать всю эту мелочь?	2	0	twenties	male	
391f19cc56c80b71950a424f9dff058a997032adeb86035391cb71d437f6de3168091c5a7aad0cbd28cc5ae0c66ba67c4e000ce26070c6d3e2810288267220b9	common_voice_ru_18882011.mp3	Обвинение, действуя в соответствии со своим мандатом, готово оказывать ему в этом содействие.	2	0	twenties	male	
391f19cc56c80b71950a424f9dff058a997032adeb86035391cb71d437f6de3168091c5a7aad0cbd28cc5ae0c66ba67c4e000ce26070c6d3e2810288267220b9	common_voice_ru_18882012.mp3	Они нас поймают и поколотят.	2	0	twenties	male	
391f19cc56c80b71950a424f9dff058a997032adeb86035391cb71d437f6de3168091c5a7aad0cbd28cc5ae0c66ba67c4e000ce26070c6d3e2810288267220b9	common_voice_ru_18882017.mp3	Мы займемся докладом в качестве нашего второго пункта сегодня.	2	0	twenties	male	
391f19cc56c80b71950a424f9dff058a997032adeb86035391cb71d437f6de3168091c5a7aad0cbd28cc5ae0c66ba67c4e000ce26070c6d3e2810288267220b9	common_voice_ru_18882019.mp3	Снаружи послышались чужие голоса.	2	0	twenties	male	
391f19cc56c80b71950a424f9dff058a997032adeb86035391cb71d437f6de3168091c5a7aad0cbd28cc5ae0c66ba67c4e000ce26070c6d3e2810288267220b9	common_voice_ru_18882020.mp3	Международное сообщество располагает значительными, но вместе с тем ограниченными возможностями.	2	0	twenties	male	
391f19cc56c80b71950a424f9dff058a997032adeb86035391cb71d437f6de3168091c5a7aad0cbd28cc5ae0c66ba67c4e000ce26070c6d3e2810288267220b9	common_voice_ru_18882021.mp3	И сам факультет был, конечно, ужасный.	2	0	twenties	male	
391f19cc56c80b71950a424f9dff058a997032adeb86035391cb71d437f6de3168091c5a7aad0cbd28cc5ae0c66ba67c4e000ce26070c6d3e2810288267220b9	common_voice_ru_18882024.mp3	Продолжайте!	2	0	twenties	male	
391f19cc56c80b71950a424f9dff058a997032adeb86035391cb71d437f6de3168091c5a7aad0cbd28cc5ae0c66ba67c4e000ce26070c6d3e2810288267220b9	common_voice_ru_18882025.mp3	Благодарю вас и предоставляю слово уважаемому послу Китая.	2	0	twenties	male	
391f19cc56c80b71950a424f9dff058a997032adeb86035391cb71d437f6de3168091c5a7aad0cbd28cc5ae0c66ba67c4e000ce26070c6d3e2810288267220b9	common_voice_ru_18882026.mp3	Именно благодаря этой резолюции нам удалось спасти тысячи жизней и защитить ливийских граждан.	2	0	twenties	male	
391f19cc56c80b71950a424f9dff058a997032adeb86035391cb71d437f6de3168091c5a7aad0cbd28cc5ae0c66ba67c4e000ce26070c6d3e2810288267220b9	common_voice_ru_18882032.mp3	Я вижу, что слово желает взять делегат Аргентины.	2	0	twenties	male	
391f19cc56c80b71950a424f9dff058a997032adeb86035391cb71d437f6de3168091c5a7aad0cbd28cc5ae0c66ba67c4e000ce26070c6d3e2810288267220b9	common_voice_ru_18882033.mp3	В некотором размытом смысле это, конечно, поле философии и есть.	2	0	twenties	male	
391f19cc56c80b71950a424f9dff058a997032adeb86035391cb71d437f6de3168091c5a7aad0cbd28cc5ae0c66ba67c4e000ce26070c6d3e2810288267220b9	common_voice_ru_18882036.mp3	Да… но я старше… и, в конце концов, так велел папа.	2	0	twenties	male	
